{
  "name": "orchestrated-delivery-greenfield",
  "description": "Guided greenfield setup that recommends an orchestrated delivery workflow with project-shaping agents, skills, artifacts, and targets.",
  "version": "0.2.0",
  "mode": "greenfield",
  "defaultSelection": {
    "bundle": "orchestrated-delivery",
    "targets": [
      "opencode",
      "vscode-copilot"
    ]
  },
  "questions": [
    {
      "id": "project-type",
      "prompt": "What kind of project are you starting?",
      "options": [
        {
          "value": "microservice-platform",
          "label": "Microservice or platform project",
          "reason": "Recommended because this setup benefits from explicit requirements, architecture, implementation, review, QA, test, and orchestration states.",
          "classification": "recommended",
          "selection": {
            "bundle": "orchestrated-delivery"
          }
        },
        {
          "value": "ai-application",
          "label": "AI or LLM application",
          "reason": "Blocked in this guided setup because its generic composition does not include the dedicated AI evaluation gate. Use ai-application-greenfield for the standard AI delivery flow, or initialize a generic bundle directly when AI-specific evaluation is intentionally not required.",
          "classification": "blocked"
        },
        {
          "value": "library-package",
          "label": "Library or package",
          "reason": "Blocked because no library-specific composition is registered; selecting this answer would materialize the same orchestrated-delivery composition as the default project type.",
          "classification": "blocked"
        },
        {
          "value": "documentation-only",
          "label": "Documentation-only project",
          "reason": "Blocked because this setup expects implementation, review, QA, and test artifacts. A documentation-specific setup should be registered separately.",
          "classification": "blocked"
        }
      ],
      "defaultOption": "microservice-platform"
    },
    {
      "id": "delivery-style",
      "prompt": "How should the work be controlled?",
      "options": [
        {
          "value": "orchestrated-delivery",
          "label": "Orchestrated delivery",
          "reason": "Recommended because the workflow has explicit handoff states and artifact contracts from requirements through QA.",
          "classification": "recommended",
          "selection": {
            "bundle": "orchestrated-delivery"
          }
        },
        {
          "value": "review-heavy",
          "label": "Review-heavy delivery",
          "reason": "Blocked because review-heavy delivery has a dedicated registered setup and workflow. Use the review-heavy-delivery-greenfield setup instead.",
          "classification": "blocked"
        },
        {
          "value": "test-first",
          "label": "Test-first delivery",
          "reason": "Blocked because no dedicated test-first workflow or composition is registered; selecting this answer would materialize the default orchestrated-delivery composition.",
          "classification": "blocked"
        },
        {
          "value": "ad-hoc",
          "label": "Ad-hoc prompting",
          "reason": "Blocked because this generator is designed to produce deterministic, validated, fail-fast agentic setups.",
          "classification": "blocked"
        }
      ],
      "defaultOption": "orchestrated-delivery"
    },
    {
      "id": "target-platforms",
      "prompt": "Which target agent platforms should be generated?",
      "options": [
        {
          "value": "opencode-and-vscode-copilot",
          "label": "OpenCode and VS Code Copilot",
          "reason": "Recommended because both target adapters are registered and the current bundle already supports both.",
          "classification": "recommended",
          "selection": {
            "targets": [
              "opencode",
              "vscode-copilot"
            ]
          }
        },
        {
          "value": "opencode-only",
          "label": "OpenCode only",
          "reason": "Compatible because the OpenCode target adapter is registered.",
          "classification": "compatible",
          "selection": {
            "targets": [
              "opencode"
            ]
          }
        },
        {
          "value": "vscode-copilot-only",
          "label": "VS Code Copilot only",
          "reason": "Compatible because the VS Code Copilot target adapter is registered.",
          "classification": "compatible",
          "selection": {
            "targets": [
              "vscode-copilot"
            ]
          }
        }
      ],
      "defaultOption": "opencode-and-vscode-copilot"
    }
  ]
}
