{
  "name": "ai-application-greenfield",
  "description": "Guided greenfield setup for AI applications with explicit AI quality, safety, failure-mode, and operational evaluation.",
  "version": "0.2.0",
  "mode": "greenfield",
  "defaultSelection": {
    "bundle": "ai-application",
    "targets": [
      "opencode",
      "vscode-copilot"
    ]
  },
  "questions": [
    {
      "id": "project-domain",
      "prompt": "What kind of project are you starting?",
      "options": [
        {
          "value": "ai-application",
          "label": "AI or LLM application",
          "reason": "Recommended because this setup materializes an AI-specific evaluation agent, skill, artifact contract, and workflow gate.",
          "classification": "recommended",
          "selection": {
            "bundle": "ai-application"
          }
        },
        {
          "value": "data-pipeline",
          "label": "Data pipeline",
          "reason": "Blocked because this setup requires AI application evaluation rather than data ingestion, transformation, and data-quality gates. Use a dedicated data-pipeline setup when registered.",
          "classification": "blocked"
        },
        {
          "value": "web-api",
          "label": "Web API",
          "reason": "Blocked because this setup includes an AI evaluation gate that a general web API does not require. Use a dedicated web-api setup when registered.",
          "classification": "blocked"
        },
        {
          "value": "library-package",
          "label": "Library or package",
          "reason": "Blocked because this setup includes AI application evaluation and final QA responsibilities beyond a focused library delivery flow. Use a dedicated library setup when registered.",
          "classification": "blocked"
        },
        {
          "value": "documentation-only",
          "label": "Documentation-only project",
          "reason": "Blocked because this setup requires implementation, AI evaluation, testing, code review, and QA artifacts.",
          "classification": "blocked"
        }
      ],
      "defaultOption": "ai-application"
    },
    {
      "id": "ai-assurance",
      "prompt": "How should AI behavior be evaluated?",
      "options": [
        {
          "value": "evidence-based-evaluation",
          "label": "Evidence-based AI evaluation",
          "reason": "Recommended because the workflow requires measurable criteria, evaluation scenarios, failure analysis, limitations, and reproducible evidence before ordinary software validation.",
          "classification": "recommended"
        },
        {
          "value": "demo-only",
          "label": "Demo-based approval",
          "reason": "Blocked because a demonstration does not provide reproducible evidence for quality, safety, failure behavior, or operating limits.",
          "classification": "blocked"
        },
        {
          "value": "ad-hoc-review",
          "label": "Ad-hoc AI review",
          "reason": "Blocked because this setup uses a deterministic AI evaluation gate with a required artifact contract.",
          "classification": "blocked"
        },
        {
          "value": "no-ai-evaluation",
          "label": "No separate AI evaluation",
          "reason": "Blocked because omitting the AI evaluation gate would require a different workflow and bundle.",
          "classification": "blocked"
        }
      ],
      "defaultOption": "evidence-based-evaluation"
    },
    {
      "id": "target-platforms",
      "prompt": "Which target agent platforms should be generated?",
      "options": [
        {
          "value": "opencode-and-vscode-copilot",
          "label": "OpenCode and VS Code Copilot",
          "reason": "Recommended because both registered target adapters support the complete AI application composition.",
          "classification": "recommended",
          "selection": {
            "targets": [
              "opencode",
              "vscode-copilot"
            ]
          }
        },
        {
          "value": "opencode-only",
          "label": "OpenCode only",
          "reason": "Compatible because the OpenCode target adapter is registered.",
          "classification": "compatible",
          "selection": {
            "targets": [
              "opencode"
            ]
          }
        },
        {
          "value": "vscode-copilot-only",
          "label": "VS Code Copilot only",
          "reason": "Compatible because the VS Code Copilot target adapter is registered.",
          "classification": "compatible",
          "selection": {
            "targets": [
              "vscode-copilot"
            ]
          }
        }
      ],
      "defaultOption": "opencode-and-vscode-copilot"
    }
  ]
}
