{
  "name": "review-heavy-delivery-greenfield",
  "description": "Guided greenfield setup for changes requiring architecture, independent code review before test execution, test evidence, and final QA acceptance.",
  "version": "0.2.0",
  "mode": "greenfield",
  "defaultSelection": {
    "bundle": "review-heavy-delivery",
    "targets": [
      "opencode",
      "vscode-copilot"
    ]
  },
  "questions": [
    {
      "id": "assurance-level",
      "prompt": "How much delivery assurance does the change require?",
      "options": [
        {
          "value": "review-heavy",
          "label": "Independent review and final QA",
          "reason": "Recommended because the workflow includes architecture, independent code review, test evidence, and QA acceptance.",
          "classification": "recommended",
          "selection": {
            "bundle": "review-heavy-delivery"
          }
        },
        {
          "value": "release-critical",
          "label": "Release-critical change",
          "reason": "Blocked because no distinct release-critical composition is registered; selecting this answer would materialize the same review-heavy-delivery composition as the default assurance level.",
          "classification": "blocked"
        },
        {
          "value": "minimal-process",
          "label": "Minimal delivery process",
          "reason": "Blocked because this setup deliberately includes separate architecture, review, test, and QA phases. Use the lean-delivery setup for focused lower-risk changes.",
          "classification": "blocked"
        }
      ],
      "defaultOption": "review-heavy"
    },
    {
      "id": "review-timing",
      "prompt": "When should independent code review occur?",
      "options": [
        {
          "value": "before-test-execution",
          "label": "Before test execution",
          "reason": "Recommended because maintainability, correctness, test design, and security findings are corrected before the formal test and QA phases.",
          "classification": "recommended",
          "selection": {
            "bundle": "review-heavy-delivery"
          }
        },
        {
          "value": "before-final-qa",
          "label": "Before final QA acceptance",
          "reason": "Blocked because this setup deliberately performs independent code review before formal test execution. Use the orchestrated-delivery setup when review should occur after tests and immediately before final QA.",
          "classification": "blocked"
        },
        {
          "value": "self-review-only",
          "label": "Implementation self-review only",
          "reason": "Blocked because the Implementer must not self-approve implementation work.",
          "classification": "blocked"
        },
        {
          "value": "after-release",
          "label": "Review after release",
          "reason": "Blocked because review is a fail-closed gate and must complete before test execution and QA acceptance.",
          "classification": "blocked"
        }
      ],
      "defaultOption": "before-test-execution"
    },
    {
      "id": "target-platforms",
      "prompt": "Which target agent platforms should be generated?",
      "options": [
        {
          "value": "opencode-and-vscode-copilot",
          "label": "OpenCode and VS Code Copilot",
          "reason": "Recommended because both registered target adapters are generated from the same validated composition.",
          "classification": "recommended",
          "selection": {
            "targets": [
              "opencode",
              "vscode-copilot"
            ]
          }
        },
        {
          "value": "opencode-only",
          "label": "OpenCode only",
          "reason": "Compatible because the OpenCode adapter is registered.",
          "classification": "compatible",
          "selection": {
            "targets": [
              "opencode"
            ]
          }
        },
        {
          "value": "vscode-copilot-only",
          "label": "VS Code Copilot only",
          "reason": "Compatible because the VS Code Copilot adapter is registered.",
          "classification": "compatible",
          "selection": {
            "targets": [
              "vscode-copilot"
            ]
          }
        }
      ],
      "defaultOption": "opencode-and-vscode-copilot"
    }
  ]
}
